{
  "version": 1,
  "project": "Daily Inbox Executable Task Graph / Agent Claim System",
  "description": "Atomic units for turning Daily Inbox development into claimable execution threads and, later, executable diagrams.",
  "tasks": [
    {
      "id": "TG-001",
      "title": "Define executable task graph contract",
      "type": "contract",
      "status": "done",
      "dependencies": [],
      "files": [
        "tasks/schema.json",
        "tasks/README.md"
      ],
      "success_criteria": [
        "Task graph schema exists and documents id, dependencies, status, success criteria, tests, review, and claim fields."
      ],
      "test_commands": [
        "python3 scripts/task_graph_validate.py"
      ],
      "review_requirements": [
        "Review schema fields for enough detail to support autonomous agent claiming."
      ],
      "linter_commands": [
        "python3 -m py_compile scripts/task_graph_lib.py"
      ],
      "claimed_by": "codex",
      "claimed_at": "2026-06-04T13:46:25Z",
      "history": [
        {
          "event": "claimed",
          "agent": "codex",
          "at": "2026-06-04T13:46:25Z"
        },
        {
          "event": "completed",
          "agent": "codex",
          "at": "2026-06-04T13:46:25Z",
          "commit": "bd6c471"
        }
      ],
      "completed_by": "codex",
      "completed_at": "2026-06-04T13:46:25Z",
      "commit": "bd6c471"
    },
    {
      "id": "TG-002",
      "title": "Create Daily Inbox task graph DAG",
      "type": "workflow",
      "status": "done",
      "dependencies": [
        "TG-001"
      ],
      "files": [
        "tasks/daily-inbox-task-graph.json"
      ],
      "success_criteria": [
        "Graph contains at least 20 atomic units with explicit dependencies and no cycles."
      ],
      "test_commands": [
        "python3 scripts/task_graph_validate.py"
      ],
      "review_requirements": [
        "Review every task for success criteria, tests, review requirements, and linter commands."
      ],
      "linter_commands": [
        "python3 -m json.tool tasks/daily-inbox-task-graph.json >/dev/null"
      ],
      "claimed_by": "codex",
      "claimed_at": "2026-06-04T13:46:25Z",
      "history": [
        {
          "event": "claimed",
          "agent": "codex",
          "at": "2026-06-04T13:46:25Z"
        },
        {
          "event": "completed",
          "agent": "codex",
          "at": "2026-06-04T13:46:25Z",
          "commit": "bd6c471"
        }
      ],
      "completed_by": "codex",
      "completed_at": "2026-06-04T13:46:25Z",
      "commit": "bd6c471"
    },
    {
      "id": "TG-003",
      "title": "Implement graph validator",
      "type": "implementation",
      "status": "done",
      "dependencies": [
        "TG-001",
        "TG-002"
      ],
      "files": [
        "scripts/task_graph_lib.py",
        "scripts/task_graph_validate.py"
      ],
      "success_criteria": [
        "Validator rejects missing fields, unknown dependencies, invalid statuses, and dependency cycles."
      ],
      "test_commands": [
        "python3 tests/test_task_graph.py",
        "python3 scripts/task_graph_validate.py"
      ],
      "review_requirements": [
        "Review validation errors for clear operator-facing messages."
      ],
      "linter_commands": [
        "python3 -m py_compile scripts/task_graph_lib.py scripts/task_graph_validate.py"
      ],
      "claimed_by": "codex",
      "claimed_at": "2026-06-04T13:46:25Z",
      "history": [
        {
          "event": "claimed",
          "agent": "codex",
          "at": "2026-06-04T13:46:25Z"
        },
        {
          "event": "completed",
          "agent": "codex",
          "at": "2026-06-04T13:46:25Z",
          "commit": "bd6c471"
        }
      ],
      "completed_by": "codex",
      "completed_at": "2026-06-04T13:46:25Z",
      "commit": "bd6c471"
    },
    {
      "id": "TG-004",
      "title": "Implement ready-task planner",
      "type": "implementation",
      "status": "done",
      "dependencies": [
        "TG-003"
      ],
      "files": [
        "scripts/task_graph_ready.py"
      ],
      "success_criteria": [
        "Ready planner lists only todo tasks whose dependencies are done."
      ],
      "test_commands": [
        "python3 tests/test_task_graph.py",
        "python3 scripts/task_graph_ready.py"
      ],
      "review_requirements": [
        "Review ready logic against status transitions and blocked tasks."
      ],
      "linter_commands": [
        "python3 -m py_compile scripts/task_graph_ready.py"
      ],
      "claimed_by": "codex",
      "claimed_at": "2026-06-04T13:46:25Z",
      "history": [
        {
          "event": "claimed",
          "agent": "codex",
          "at": "2026-06-04T13:46:25Z"
        },
        {
          "event": "completed",
          "agent": "codex",
          "at": "2026-06-04T13:46:25Z",
          "commit": "bd6c471"
        }
      ],
      "completed_by": "codex",
      "completed_at": "2026-06-04T13:46:25Z",
      "commit": "bd6c471"
    },
    {
      "id": "TG-005",
      "title": "Implement execution thread planner",
      "type": "implementation",
      "status": "done",
      "dependencies": [
        "TG-003"
      ],
      "files": [
        "scripts/task_graph_threads.py"
      ],
      "success_criteria": [
        "Planner outputs parallel waves and serial execution threads from the dependency graph."
      ],
      "test_commands": [
        "python3 tests/test_task_graph.py",
        "python3 scripts/task_graph_threads.py"
      ],
      "review_requirements": [
        "Review whether waves and threads are understandable enough for agent dispatch."
      ],
      "linter_commands": [
        "python3 -m py_compile scripts/task_graph_threads.py"
      ],
      "claimed_by": "codex",
      "claimed_at": "2026-06-04T13:46:25Z",
      "history": [
        {
          "event": "claimed",
          "agent": "codex",
          "at": "2026-06-04T13:46:25Z"
        },
        {
          "event": "completed",
          "agent": "codex",
          "at": "2026-06-04T13:46:25Z",
          "commit": "bd6c471"
        }
      ],
      "completed_by": "codex",
      "completed_at": "2026-06-04T13:46:25Z",
      "commit": "bd6c471"
    },
    {
      "id": "TG-006",
      "title": "Implement claim and complete commands",
      "type": "implementation",
      "status": "done",
      "dependencies": [
        "TG-004"
      ],
      "files": [
        "scripts/task_claim.py",
        "scripts/task_complete.py"
      ],
      "success_criteria": [
        "Agents can claim ready tasks and mark claimed tasks complete with history metadata."
      ],
      "test_commands": [
        "python3 tests/test_task_graph.py"
      ],
      "review_requirements": [
        "Review claim failure modes for already claimed, blocked, or unknown tasks."
      ],
      "linter_commands": [
        "python3 -m py_compile scripts/task_claim.py scripts/task_complete.py"
      ],
      "claimed_by": "codex",
      "claimed_at": "2026-06-04T13:46:25Z",
      "history": [
        {
          "event": "claimed",
          "agent": "codex",
          "at": "2026-06-04T13:46:25Z"
        },
        {
          "event": "completed",
          "agent": "codex",
          "at": "2026-06-04T13:46:25Z",
          "commit": "bd6c471"
        }
      ],
      "completed_by": "codex",
      "completed_at": "2026-06-04T13:46:25Z",
      "commit": "bd6c471"
    },
    {
      "id": "DG-001",
      "title": "Define executable workflow graph contract",
      "type": "contract",
      "status": "done",
      "dependencies": [
        "TG-003"
      ],
      "files": [
        "workflow/diagram/schema.json",
        "workflow/diagram/README.md"
      ],
      "success_criteria": [
        "Workflow graph schema defines nodes, edges, command adapters, inputs, outputs, and failure paths."
      ],
      "test_commands": [
        "python3 scripts/workflow_graph_validate.py"
      ],
      "review_requirements": [
        "Review that diagram semantics are executable, not just documentation."
      ],
      "linter_commands": [
        "python3 -m py_compile scripts/workflow_graph_validate.py"
      ],
      "claimed_by": "codex",
      "claimed_at": "2026-06-04T13:50:59Z",
      "history": [
        {
          "event": "claimed",
          "agent": "codex",
          "at": "2026-06-04T13:50:59Z"
        },
        {
          "event": "completed",
          "agent": "codex",
          "at": "2026-06-04T13:50:59Z",
          "commit": "5b94f1b"
        }
      ],
      "completed_by": "codex",
      "completed_at": "2026-06-04T13:50:59Z",
      "commit": "5b94f1b"
    },
    {
      "id": "DG-002",
      "title": "Create Daily Inbox executable workflow graph",
      "type": "workflow",
      "status": "done",
      "dependencies": [
        "DG-001"
      ],
      "files": [
        "workflow/diagram/daily-newsletter.graph.json"
      ],
      "success_criteria": [
        "Graph covers fetch, enrichment, scoring, aggregation, quality, finalize, health, and alert nodes."
      ],
      "test_commands": [
        "python3 scripts/workflow_graph_validate.py"
      ],
      "review_requirements": [
        "Review node boundaries against current root command wrappers."
      ],
      "linter_commands": [
        "python3 -m json.tool workflow/diagram/daily-newsletter.graph.json >/dev/null"
      ],
      "claimed_by": "codex",
      "claimed_at": "2026-06-04T13:50:59Z",
      "history": [
        {
          "event": "claimed",
          "agent": "codex",
          "at": "2026-06-04T13:50:59Z"
        },
        {
          "event": "completed",
          "agent": "codex",
          "at": "2026-06-04T13:50:59Z",
          "commit": "5b94f1b"
        }
      ],
      "completed_by": "codex",
      "completed_at": "2026-06-04T13:50:59Z",
      "commit": "5b94f1b"
    },
    {
      "id": "DG-003",